{
  "format": "tt.conformance.vector/v1",
  "id": "1328-sampling-subject-before-trace",
  "category": "subject-sampling",
  "description": "With subject and trace, the subject decides.",
  "spec": ["sanitizer.md#12"],
  "policy": {
    "format": "tt.policy.body/v1",
    "policy_id": "p-conformance",
    "version": 1,
    "issued_seq": 1,
    "created_at": "2026-10-20T08:00:00Z",
    "not_after": "2026-11-19T08:00:00Z",
    "targets": {
      "groups": ["shop"]
    },
    "hmac": {
      "kid": "k1",
      "accept_kids": [],
      "epoch": "2026-10"
    },
    "sampling": {
      "rate_bp": 9374,
      "trust_baggage": false,
      "propagate_to": []
    },
    "segments": {
      "auto_words": false,
      "allow": [],
      "hosts_allow": []
    },
    "limits": {
      "max_body_bytes": 1048576,
      "max_depth": 32,
      "max_array": 32,
      "max_keys": 256,
      "keep_max_bytes": 64
    },
    "global": {},
    "services": [],
    "identity": {
      "subject": {
        "from": "header",
        "name": "x-customer-id"
      }
    }
  },
  "source_group": "shop",
  "hmac_key": "k1:AAECAwQFBgcICQoLDA0ODxAREhMUFRYXGBkaGxwdHh8",
  "now": "2026-10-23T10:00:00Z",
  "input": {
    "dir": "inbound",
    "service_name": "shop-api",
    "method": "GET",
    "raw_path": "/",
    "trace_id": "4bf92f3577b34da6a3ce929d0e0e4736",
    "req_headers": [
      ["X-Customer-Id", "C-10042"]
    ],
    "status": 200,
    "resp_headers": []
  },
  "expected": {
    "outcome": "event",
    "canonical": "{\"op\":\"GET /\",\"req\":{\"headers\":{\"x-customer-id\":[\"drop:str:l8\"]},\"path\":\"/\",\"size\":\"l8\"},\"resp\":{\"size\":\"l8\"},\"route_source\":\"raw\",\"sampled_by\":\"subject\",\"service\":\"shop-api\",\"subject\":\"tk1:k1:2-TTeEIdTaDub64sBbER6A\"}"
  }
}
