{
  "format": "tt.conformance.vector/v1",
  "id": "1518-adv-number-key-pii",
  "category": "adversarial",
  "description": "Numeric keys holding phone numbers collapse.",
  "spec": ["sanitizer.md#9.3"],
  "policy_ref": "policies/empty.json",
  "source_group": "shop",
  "hmac_key": "k1:AAECAwQFBgcICQoLDA0ODxAREhMUFRYXGBkaGxwdHh8",
  "now": "2026-10-23T10:00:00Z",
  "input": {
    "dir": "inbound",
    "service_name": "shop-api",
    "method": "POST",
    "raw_path": "/orders",
    "req_headers": [
      ["Content-Type", "application/json"]
    ],
    "req_body": {
      "b64": "eyIzOTAyMTIzNDU2NzgiOnsiY2FsbHMiOjN9fQ==",
      "text": "{\"390212345678\":{\"calls\":3}}"
    },
    "status": 200,
    "resp_headers": []
  },
  "expected": {
    "outcome": "event",
    "canonical": "{\"op\":\"POST /{drop:str:l8}\",\"req\":{\"body\":{\"{*}\":[{\"calls\":\"drop:int\"}]},\"ct\":\"application/json\",\"headers\":{\"content-type\":[\"drop:str:l32\"]},\"path\":\"/{drop:str:l8}\",\"size\":\"l32\"},\"resp\":{\"size\":\"l8\"},\"route_source\":\"raw\",\"sampled_by\":\"random\",\"service\":\"shop-api\"}"
  }
}
