{
  "format": "tt.conformance.vector/v1",
  "id": "2184-refuse-json-path-empty-member",
  "category": "refusal",
  "description": "A path with an empty member (\"a..b\") is not valid.",
  "spec": ["policy.md#7.1", "sanitizer.md#11"],
  "policy": {
    "format": "tt.policy.body/v1",
    "policy_id": "p-conformance",
    "version": 1,
    "issued_seq": 1,
    "created_at": "2026-10-20T08:00:00Z",
    "not_after": "2026-11-19T08:00:00Z",
    "targets": {
      "groups": ["shop"]
    },
    "hmac": {
      "kid": "k1",
      "accept_kids": [],
      "epoch": "2026-10"
    },
    "sampling": {
      "rate_bp": 10000,
      "trust_baggage": false,
      "propagate_to": []
    },
    "segments": {
      "auto_words": false,
      "allow": [],
      "hosts_allow": []
    },
    "limits": {
      "max_body_bytes": 1048576,
      "max_depth": 32,
      "max_array": 32,
      "max_keys": 256,
      "keep_max_bytes": 64
    },
    "global": {},
    "services": [],
    "identity": {
      "subject": {
        "from": "header",
        "name": "x-user-context",
        "json_path": "a..b"
      }
    }
  },
  "source_group": "shop",
  "hmac_key": "k1:AAECAwQFBgcICQoLDA0ODxAREhMUFRYXGBkaGxwdHh8",
  "now": "2026-10-23T10:00:00Z",
  "input": {
    "dir": "inbound",
    "service_name": "shop-api",
    "method": "GET",
    "raw_path": "/",
    "req_headers": [],
    "status": 200,
    "resp_headers": []
  },
  "expected": {
    "outcome": "refused",
    "code": "policy_rejected"
  }
}
