{
  "format": "tt.conformance.vector/v1",
  "id": "0403-cookies-first-equals-and-quotes",
  "category": "cookies",
  "description": "Split on the first \"=\"; outer double quotes are kept.",
  "spec": ["sanitizer.md#8.2"],
  "policy": {
    "format": "tt.policy.body/v1",
    "policy_id": "p-conformance",
    "version": 1,
    "issued_seq": 1,
    "created_at": "2026-10-20T08:00:00Z",
    "not_after": "2026-11-19T08:00:00Z",
    "targets": {
      "groups": ["shop"]
    },
    "hmac": {
      "kid": "k1",
      "accept_kids": [],
      "epoch": "2026-10"
    },
    "sampling": {
      "rate_bp": 10000,
      "trust_baggage": false,
      "propagate_to": []
    },
    "segments": {
      "auto_words": false,
      "allow": [],
      "hosts_allow": []
    },
    "limits": {
      "max_body_bytes": 1048576,
      "max_depth": 32,
      "max_array": 32,
      "max_keys": 256,
      "keep_max_bytes": 64
    },
    "global": {
      "request": {
        "cookies": {
          "a": {
            "action": "keep"
          },
          "q": {
            "action": "keep"
          }
        }
      }
    },
    "services": []
  },
  "source_group": "shop",
  "hmac_key": "k1:AAECAwQFBgcICQoLDA0ODxAREhMUFRYXGBkaGxwdHh8",
  "now": "2026-10-23T10:00:00Z",
  "input": {
    "dir": "inbound",
    "service_name": "shop-api",
    "method": "GET",
    "raw_path": "/",
    "req_headers": [
      ["Cookie", "a=b=c; q=\"xyz\""]
    ],
    "status": 200,
    "resp_headers": []
  },
  "expected": {
    "outcome": "event",
    "canonical": "{\"op\":\"GET /\",\"req\":{\"cookies\":{\"a\":[\"keep:b=c\"],\"q\":[\"keep:\\\"xyz\\\"\"]},\"path\":\"/\",\"size\":\"l8\"},\"resp\":{\"size\":\"l8\"},\"route_source\":\"raw\",\"sampled_by\":\"random\",\"service\":\"shop-api\"}"
  }
}
