{
  "format": "tt.conformance.vector/v1",
  "id": "1908-hosts-off-hosts-allow",
  "category": "hosts",
  "description": "hosts.discovery off: a host in segments.hosts_allow still leaves exactly as listed.",
  "spec": ["sanitizer.md#3.1", "sanitizer.md#3.5"],
  "policy": {
    "format": "tt.policy.body/v1",
    "policy_id": "p-conformance",
    "version": 1,
    "issued_seq": 1,
    "created_at": "2026-10-20T08:00:00Z",
    "not_after": "2026-11-19T08:00:00Z",
    "targets": {
      "groups": ["shop"]
    },
    "hmac": {
      "kid": "k1",
      "accept_kids": [],
      "epoch": "2026-10"
    },
    "sampling": {
      "rate_bp": 10000,
      "trust_baggage": false,
      "propagate_to": []
    },
    "segments": {
      "auto_words": false,
      "allow": [],
      "hosts_allow": ["api.partner.example"]
    },
    "limits": {
      "max_body_bytes": 1048576,
      "max_depth": 32,
      "max_array": 32,
      "max_keys": 256,
      "keep_max_bytes": 64
    },
    "global": {},
    "services": [],
    "hosts": {
      "discovery": "off"
    }
  },
  "source_group": "shop",
  "hmac_key": "k1:AAECAwQFBgcICQoLDA0ODxAREhMUFRYXGBkaGxwdHh8",
  "now": "2026-10-23T10:00:00Z",
  "input": {
    "dir": "outbound",
    "url_base": "https://api.partner.example",
    "method": "GET",
    "raw_path": "/",
    "req_headers": [],
    "status": 200,
    "resp_headers": []
  },
  "expected": {
    "outcome": "event",
    "canonical": "{\"op\":\"GET /\",\"req\":{\"path\":\"/\",\"size\":\"l8\"},\"resp\":{\"size\":\"l8\"},\"route_source\":\"raw\",\"sampled_by\":\"random\",\"service\":\"host:api.partner.example\"}"
  }
}
