{
  "format": "tt.conformance.vector/v1",
  "id": "1783-accept-h2-global-star-drop",
  "category": "refusal",
  "description": "drop on $.* in the global rules is accepted: only keep and hmac are refused.",
  "spec": ["hardening.md#2.1", "hardening.md#2.2", "policy.md#4"],
  "policy": {
    "format": "tt.policy.body/v1",
    "policy_id": "p-conformance",
    "version": 1,
    "issued_seq": 1,
    "created_at": "2026-10-20T08:00:00Z",
    "not_after": "2026-11-19T08:00:00Z",
    "targets": {
      "groups": ["shop"]
    },
    "hmac": {
      "kid": "k1",
      "accept_kids": [],
      "epoch": "2026-10"
    },
    "sampling": {
      "rate_bp": 10000,
      "trust_baggage": false,
      "propagate_to": []
    },
    "segments": {
      "auto_words": false,
      "allow": [],
      "hosts_allow": []
    },
    "limits": {
      "max_body_bytes": 1048576,
      "max_depth": 32,
      "max_array": 32,
      "max_keys": 256,
      "keep_max_bytes": 64
    },
    "global": {
      "request": {
        "body": [
          {
            "path": "$.*",
            "action": {
              "action": "drop"
            }
          }
        ]
      }
    },
    "services": []
  },
  "source_group": "shop",
  "hmac_key": "k1:AAECAwQFBgcICQoLDA0ODxAREhMUFRYXGBkaGxwdHh8",
  "now": "2026-10-23T10:00:00Z",
  "input": {
    "dir": "inbound",
    "service_name": "shop-api",
    "method": "POST",
    "raw_path": "/orders",
    "req_headers": [
      ["Content-Type", "application/json"]
    ],
    "req_body": {
      "b64": "eyJhIjoieCJ9",
      "text": "{\"a\":\"x\"}"
    },
    "status": 200,
    "resp_headers": []
  },
  "expected": {
    "outcome": "event",
    "canonical": "{\"op\":\"POST /{drop:str:l8}\",\"req\":{\"body\":{\"a\":\"drop:str:l8\"},\"ct\":\"application/json\",\"headers\":{\"content-type\":[\"drop:str:l32\"]},\"path\":\"/{drop:str:l8}\",\"size\":\"l32\"},\"resp\":{\"size\":\"l8\"},\"route_source\":\"raw\",\"sampled_by\":\"random\",\"service\":\"shop-api\"}"
  }
}
