{
  "format": "tt.conformance.vector/v1",
  "id": "2116-subject-json-trim-base64",
  "category": "subject-sampling",
  "description": "Spaces and tabs around the value are removed (base64).",
  "spec": ["sanitizer.md#11"],
  "policy": {
    "format": "tt.policy.body/v1",
    "policy_id": "p-conformance",
    "version": 1,
    "issued_seq": 1,
    "created_at": "2026-10-20T08:00:00Z",
    "not_after": "2026-11-19T08:00:00Z",
    "targets": {
      "groups": ["shop"]
    },
    "hmac": {
      "kid": "k1",
      "accept_kids": [],
      "epoch": "2026-10"
    },
    "sampling": {
      "rate_bp": 10000,
      "trust_baggage": false,
      "propagate_to": []
    },
    "segments": {
      "auto_words": false,
      "allow": [],
      "hosts_allow": []
    },
    "limits": {
      "max_body_bytes": 1048576,
      "max_depth": 32,
      "max_array": 32,
      "max_keys": 256,
      "keep_max_bytes": 64
    },
    "global": {},
    "services": [],
    "identity": {
      "subject": {
        "from": "header",
        "name": "x-user-context",
        "json_path": "user.id"
      }
    }
  },
  "source_group": "shop",
  "hmac_key": "k1:AAECAwQFBgcICQoLDA0ODxAREhMUFRYXGBkaGxwdHh8",
  "now": "2026-10-23T10:00:00Z",
  "input": {
    "dir": "inbound",
    "service_name": "shop-api",
    "method": "GET",
    "raw_path": "/",
    "req_headers": [
      ["X-User-Context", " \u0009eyJ1c2VyIjp7ImlkIjoidS0xMDA0MiJ9LCJwYWQiOiI/Pz4+fn4ifQ==\u0009 "]
    ],
    "status": 200,
    "resp_headers": []
  },
  "expected": {
    "outcome": "event",
    "canonical": "{\"op\":\"GET /\",\"req\":{\"headers\":{\"x-user-context\":[\"drop:str:l128\"]},\"path\":\"/\",\"size\":\"l8\"},\"resp\":{\"size\":\"l8\"},\"route_source\":\"raw\",\"sampled_by\":\"subject\",\"service\":\"shop-api\",\"subject\":\"tk1:k1:-V14vqKJriHUyW5YwjGQvg\"}"
  }
}
