{
  "format": "tt.conformance.vector/v1",
  "id": "1343-sampling-outbound-no-baggage",
  "category": "subject-sampling",
  "description": "Outbound calls never follow baggage.",
  "spec": ["sanitizer.md#12"],
  "policy": {
    "format": "tt.policy.body/v1",
    "policy_id": "p-conformance",
    "version": 1,
    "issued_seq": 1,
    "created_at": "2026-10-20T08:00:00Z",
    "not_after": "2026-11-19T08:00:00Z",
    "targets": {
      "groups": ["shop"]
    },
    "hmac": {
      "kid": "k1",
      "accept_kids": [],
      "epoch": "2026-10"
    },
    "sampling": {
      "rate_bp": 10000,
      "trust_baggage": true,
      "propagate_to": []
    },
    "segments": {
      "auto_words": false,
      "allow": [],
      "hosts_allow": []
    },
    "limits": {
      "max_body_bytes": 1048576,
      "max_depth": 32,
      "max_array": 32,
      "max_keys": 256,
      "keep_max_bytes": 64
    },
    "global": {},
    "services": []
  },
  "source_group": "shop",
  "hmac_key": "k1:AAECAwQFBgcICQoLDA0ODxAREhMUFRYXGBkaGxwdHh8",
  "now": "2026-10-23T10:00:00Z",
  "input": {
    "dir": "outbound",
    "url_base": "https://api.carrier.example",
    "method": "GET",
    "raw_path": "/v1/rates",
    "req_headers": [
      ["baggage", "tt.s=0"]
    ],
    "status": 200,
    "resp_headers": []
  },
  "expected": {
    "outcome": "event",
    "canonical": "{\"op\":\"GET /{drop:str:l8}/{drop:str:l8}\",\"req\":{\"headers\":{\"baggage\":[\"drop:str:l8\"]},\"path\":\"/{drop:str:l8}/{drop:str:l8}\",\"size\":\"l8\"},\"resp\":{\"size\":\"l8\"},\"route_source\":\"raw\",\"sampled_by\":\"random\",\"service\":\"host:api.carrier.example\"}"
  }
}
