{
  "format": "tt.conformance.vector/v1",
  "id": "0905-bucket-num-extremes",
  "category": "actions",
  "description": "bucket(num) with lexemes that overflow or underflow a double.",
  "spec": ["sanitizer.md#5.5"],
  "policy": {
    "format": "tt.policy.body/v1",
    "policy_id": "p-conformance",
    "version": 1,
    "issued_seq": 1,
    "created_at": "2026-10-20T08:00:00Z",
    "not_after": "2026-11-19T08:00:00Z",
    "targets": {
      "groups": ["shop"]
    },
    "hmac": {
      "kid": "k1",
      "accept_kids": [],
      "epoch": "2026-10"
    },
    "sampling": {
      "rate_bp": 10000,
      "trust_baggage": false,
      "propagate_to": []
    },
    "segments": {
      "auto_words": false,
      "allow": [],
      "hosts_allow": []
    },
    "limits": {
      "max_body_bytes": 1048576,
      "max_depth": 32,
      "max_array": 32,
      "max_keys": 256,
      "keep_max_bytes": 64
    },
    "global": {
      "request": {
        "body": [
          {
            "path": "$[*]",
            "action": {
              "action": "bucket",
              "kind": "num",
              "bounds": [0, 50, 100, 250]
            }
          }
        ]
      }
    },
    "services": []
  },
  "source_group": "shop",
  "hmac_key": "k1:AAECAwQFBgcICQoLDA0ODxAREhMUFRYXGBkaGxwdHh8",
  "now": "2026-10-23T10:00:00Z",
  "input": {
    "dir": "inbound",
    "service_name": "shop-api",
    "method": "POST",
    "raw_path": "/orders",
    "req_headers": [
      ["Content-Type", "application/json"]
    ],
    "req_body": {
      "b64": "WzFlNDAwLC0xZTQwMCwxZS00MDAsLTFlLTQwMCwxMjM0NTY3ODkwMTIzNDU2Nzg5MDEyMzQ1Njc4OTBd",
      "text": "[1e400,-1e400,1e-400,-1e-400,123456789012345678901234567890]"
    },
    "status": 200,
    "resp_headers": []
  },
  "expected": {
    "outcome": "event",
    "canonical": "{\"op\":\"POST /{drop:str:l8}\",\"req\":{\"body\":[\"num:>=250\",\"num:<0\",\"num:0-50\",\"num:0-50\",\"num:>=250\"],\"ct\":\"application/json\",\"headers\":{\"content-type\":[\"drop:str:l32\"]},\"path\":\"/{drop:str:l8}\",\"size\":\"l128\"},\"resp\":{\"size\":\"l8\"},\"route_source\":\"raw\",\"sampled_by\":\"random\",\"service\":\"shop-api\"}"
  }
}
